<?xml version="1.0" encoding="UTF-8"?>
<xsd:schema xmlns:xsd="http://www.w3.org/2000/10/XMLSchema" xmlns:od="urn:schemas-microsoft-com:officedata">
<xsd:element name="dataroot">
<xsd:complexType>
<xsd:choice maxOccurs="unbounded">
<xsd:element ref="tblVapen"/>
</xsd:choice>
</xsd:complexType>
</xsd:element>
<xsd:element name="tblVapen">
<xsd:annotation>
<xsd:appinfo>
<od:index index-name="PrimaryKey" index-key="idV " primary="yes" unique="yes" clustered="no"/>
<od:index index-name="Vapen" index-key="Vapen " primary="no" unique="no" clustered="no"/>
<od:index index-name="Vapennamn" index-key="Vapennamn " primary="no" unique="no" clustered="no"/>
</xsd:appinfo>
</xsd:annotation>
<xsd:complexType>
<xsd:sequence>
<xsd:element name="idV" od:jetType="autonumber" od:sqlSType="int" od:autoUnique="yes" od:nonNullable="yes">
<xsd:simpleType>
<xsd:restriction base="xsd:integer"/>
</xsd:simpleType>
</xsd:element>
<xsd:element name="Vapennamn" minOccurs="0" od:jetType="text" od:sqlSType="nvarchar">
<xsd:simpleType>
<xsd:restriction base="xsd:string">
<xsd:maxLength value="30"/>
</xsd:restriction>
</xsd:simpleType>
</xsd:element>
<xsd:element name="Vapen" minOccurs="0" od:jetType="text" od:sqlSType="nvarchar">
<xsd:simpleType>
<xsd:restriction base="xsd:string">
<xsd:maxLength value="5"/>
</xsd:restriction>
</xsd:simpleType>
</xsd:element>
<xsd:element name="A1" od:jetType="yesno" od:sqlSType="bit" od:nonNullable="yes" type="xsd:byte"/>
<xsd:element name="A2" od:jetType="yesno" od:sqlSType="bit" od:nonNullable="yes" type="xsd:byte"/>
<xsd:element name="A3" od:jetType="yesno" od:sqlSType="bit" od:nonNullable="yes" type="xsd:byte"/>
<xsd:element name="B" od:jetType="yesno" od:sqlSType="bit" od:nonNullable="yes" type="xsd:byte"/>
<xsd:element name="C" od:jetType="yesno" od:sqlSType="bit" od:nonNullable="yes" type="xsd:byte"/>
</xsd:sequence>
</xsd:complexType>
</xsd:element>
</xsd:schema>
